<?xml version="1.0" encoding="UTF-8"?><!DOCTYPE Carnet PUBLIC "CarnetId" "Carnet.dtd"><carnet><type>commun</type><contact><nom>Bessac</nom><prenom>Bilbo</prenom><information><libelle>Hobby</libelle><texte>Musique</texte><information><libelle>Loisir</libelle><texte>Kayak Polo</texte></contact></carnet>